{
  "schema_version": 1,
  "synthetic": true,
  "as_of": "2026-10-28T20:00:00+00:00",
  "categories": [
    "Research",
    "Publications",
    "Workshops"
  ],
  "analytics": [
    {
      "date": "2026-09-03",
      "category": "Research",
      "sessions": 140,
      "downloads": 18,
      "completions": 8,
      "duration_seconds": 16800
    },
    {
      "date": "2026-09-03",
      "category": "Publications",
      "sessions": 177,
      "downloads": 25,
      "completions": 11,
      "duration_seconds": 22833
    },
    {
      "date": "2026-09-03",
      "category": "Workshops",
      "sessions": 214,
      "downloads": 32,
      "completions": 14,
      "duration_seconds": 29532
    },
    {
      "date": "2026-09-04",
      "category": "Research",
      "sessions": 154,
      "downloads": 21,
      "completions": 9,
      "duration_seconds": 18634
    },
    {
      "date": "2026-09-04",
      "category": "Publications",
      "sessions": 191,
      "downloads": 28,
      "completions": 12,
      "duration_seconds": 24830
    },
    {
      "date": "2026-09-04",
      "category": "Workshops",
      "sessions": 228,
      "downloads": 35,
      "completions": 15,
      "duration_seconds": 31692
    },
    {
      "date": "2026-09-05",
      "category": "Research",
      "sessions": 168,
      "downloads": 24,
      "completions": 10,
      "duration_seconds": 20496
    },
    {
      "date": "2026-09-05",
      "category": "Publications",
      "sessions": 205,
      "downloads": 31,
      "completions": 13,
      "duration_seconds": 26855
    },
    {
      "date": "2026-09-05",
      "category": "Workshops",
      "sessions": 242,
      "downloads": 38,
      "completions": 16,
      "duration_seconds": 33880
    },
    {
      "date": "2026-09-06",
      "category": "Research",
      "sessions": 182,
      "downloads": 27,
      "completions": 11,
      "duration_seconds": 22386
    },
    {
      "date": "2026-09-06",
      "category": "Publications",
      "sessions": 219,
      "downloads": 34,
      "completions": 14,
      "duration_seconds": 28908
    },
    {
      "date": "2026-09-06",
      "category": "Workshops",
      "sessions": 256,
      "downloads": 41,
      "completions": 17,
      "duration_seconds": 36096
    },
    {
      "date": "2026-09-07",
      "category": "Research",
      "sessions": 196,
      "downloads": 30,
      "completions": 12,
      "duration_seconds": 24304
    },
    {
      "date": "2026-09-07",
      "category": "Publications",
      "sessions": 233,
      "downloads": 37,
      "completions": 15,
      "duration_seconds": 30989
    },
    {
      "date": "2026-09-07",
      "category": "Workshops",
      "sessions": 270,
      "downloads": 44,
      "completions": 18,
      "duration_seconds": 38340
    },
    {
      "date": "2026-09-08",
      "category": "Research",
      "sessions": 210,
      "downloads": 33,
      "completions": 13,
      "duration_seconds": 26250
    },
    {
      "date": "2026-09-08",
      "category": "Publications",
      "sessions": 247,
      "downloads": 40,
      "completions": 16,
      "duration_seconds": 33098
    },
    {
      "date": "2026-09-08",
      "category": "Workshops",
      "sessions": 284,
      "downloads": 47,
      "completions": 19,
      "duration_seconds": 40612
    },
    {
      "date": "2026-09-09",
      "category": "Research",
      "sessions": 224,
      "downloads": 36,
      "completions": 14,
      "duration_seconds": 28224
    },
    {
      "date": "2026-09-09",
      "category": "Publications",
      "sessions": 261,
      "downloads": 43,
      "completions": 17,
      "duration_seconds": 35235
    },
    {
      "date": "2026-09-09",
      "category": "Workshops",
      "sessions": 298,
      "downloads": 50,
      "completions": 20,
      "duration_seconds": 42912
    },
    {
      "date": "2026-09-10",
      "category": "Research",
      "sessions": 161,
      "downloads": 39,
      "completions": 15,
      "duration_seconds": 20447
    },
    {
      "date": "2026-09-10",
      "category": "Publications",
      "sessions": 198,
      "downloads": 46,
      "completions": 18,
      "duration_seconds": 26928
    },
    {
      "date": "2026-09-10",
      "category": "Workshops",
      "sessions": 235,
      "downloads": 53,
      "completions": 21,
      "duration_seconds": 34075
    },
    {
      "date": "2026-09-11",
      "category": "Research",
      "sessions": 175,
      "downloads": 42,
      "completions": 16,
      "duration_seconds": 22400
    },
    {
      "date": "2026-09-11",
      "category": "Publications",
      "sessions": 212,
      "downloads": 49,
      "completions": 19,
      "duration_seconds": 29044
    },
    {
      "date": "2026-09-11",
      "category": "Workshops",
      "sessions": 249,
      "downloads": 56,
      "completions": 22,
      "duration_seconds": 36354
    },
    {
      "date": "2026-09-12",
      "category": "Research",
      "sessions": 189,
      "downloads": 45,
      "completions": 17,
      "duration_seconds": 24381
    },
    {
      "date": "2026-09-12",
      "category": "Publications",
      "sessions": 226,
      "downloads": 52,
      "completions": 20,
      "duration_seconds": 31188
    },
    {
      "date": "2026-09-12",
      "category": "Workshops",
      "sessions": 263,
      "downloads": 59,
      "completions": 23,
      "duration_seconds": 38661
    },
    {
      "date": "2026-09-13",
      "category": "Research",
      "sessions": 203,
      "downloads": 48,
      "completions": 18,
      "duration_seconds": 26390
    },
    {
      "date": "2026-09-13",
      "category": "Publications",
      "sessions": 240,
      "downloads": 55,
      "completions": 21,
      "duration_seconds": 33360
    },
    {
      "date": "2026-09-13",
      "category": "Workshops",
      "sessions": 277,
      "downloads": 62,
      "completions": 24,
      "duration_seconds": 40996
    },
    {
      "date": "2026-09-14",
      "category": "Research",
      "sessions": 217,
      "downloads": 51,
      "completions": 19,
      "duration_seconds": 28427
    },
    {
      "date": "2026-09-14",
      "category": "Publications",
      "sessions": 254,
      "downloads": 58,
      "completions": 22,
      "duration_seconds": 35560
    },
    {
      "date": "2026-09-14",
      "category": "Workshops",
      "sessions": 291,
      "downloads": 65,
      "completions": 25,
      "duration_seconds": 43359
    },
    {
      "date": "2026-09-15",
      "category": "Research",
      "sessions": 231,
      "downloads": 54,
      "completions": 20,
      "duration_seconds": 30492
    },
    {
      "date": "2026-09-15",
      "category": "Publications",
      "sessions": 268,
      "downloads": 61,
      "completions": 23,
      "duration_seconds": 37788
    },
    {
      "date": "2026-09-15",
      "category": "Workshops",
      "sessions": 305,
      "downloads": 68,
      "completions": 26,
      "duration_seconds": 45750
    },
    {
      "date": "2026-09-16",
      "category": "Research",
      "sessions": 245,
      "downloads": 57,
      "completions": 21,
      "duration_seconds": 32585
    },
    {
      "date": "2026-09-16",
      "category": "Publications",
      "sessions": 282,
      "downloads": 64,
      "completions": 24,
      "duration_seconds": 40044
    },
    {
      "date": "2026-09-16",
      "category": "Workshops",
      "sessions": 319,
      "downloads": 71,
      "completions": 27,
      "duration_seconds": 48169
    },
    {
      "date": "2026-09-17",
      "category": "Research",
      "sessions": 182,
      "downloads": 60,
      "completions": 22,
      "duration_seconds": 24388
    },
    {
      "date": "2026-09-17",
      "category": "Publications",
      "sessions": 219,
      "downloads": 67,
      "completions": 25,
      "duration_seconds": 31317
    },
    {
      "date": "2026-09-17",
      "category": "Workshops",
      "sessions": 256,
      "downloads": 19,
      "completions": 28,
      "duration_seconds": 38912
    },
    {
      "date": "2026-09-18",
      "category": "Research",
      "sessions": 196,
      "downloads": 63,
      "completions": 23,
      "duration_seconds": 26460
    },
    {
      "date": "2026-09-18",
      "category": "Publications",
      "sessions": 233,
      "downloads": 70,
      "completions": 26,
      "duration_seconds": 33552
    },
    {
      "date": "2026-09-18",
      "category": "Workshops",
      "sessions": 270,
      "downloads": 22,
      "completions": 8,
      "duration_seconds": 41310
    },
    {
      "date": "2026-09-19",
      "category": "Research",
      "sessions": 210,
      "downloads": 66,
      "completions": 24,
      "duration_seconds": 28560
    },
    {
      "date": "2026-09-19",
      "category": "Publications",
      "sessions": 247,
      "downloads": 18,
      "completions": 27,
      "duration_seconds": 35815
    },
    {
      "date": "2026-09-19",
      "category": "Workshops",
      "sessions": 284,
      "downloads": 25,
      "completions": 9,
      "duration_seconds": 43736
    },
    {
      "date": "2026-09-20",
      "category": "Research",
      "sessions": 224,
      "downloads": 69,
      "completions": 25,
      "duration_seconds": 30688
    },
    {
      "date": "2026-09-20",
      "category": "Publications",
      "sessions": 261,
      "downloads": 21,
      "completions": 28,
      "duration_seconds": 38106
    },
    {
      "date": "2026-09-20",
      "category": "Workshops",
      "sessions": 298,
      "downloads": 28,
      "completions": 10,
      "duration_seconds": 46190
    },
    {
      "date": "2026-09-21",
      "category": "Research",
      "sessions": 238,
      "downloads": 72,
      "completions": 26,
      "duration_seconds": 32844
    },
    {
      "date": "2026-09-21",
      "category": "Publications",
      "sessions": 275,
      "downloads": 24,
      "completions": 8,